{
  "schema_version": "aeye.source-ledger.v0",
  "cutoff_date": "2026-09-21",
  "verified_at": "2026-09-21T09:45:45Z",
  "entries": [
    {
      "source_id": "arxiv:2409.12055v2",
      "kind": "paper",
      "title": "Artemis: Efficient Commit-and-Prove SNARKs for zkML",
      "authors": ["Hidde Lycklama", "Alexander Viand", "Nikolay Avramov", "Nicolas Küchler", "Anwar Hithnawi"],
      "version": "arXiv:2409.12055v2",
      "publication_date": "2025-06-13",
      "publication_date_status": "known",
      "publication_date_precision": "day",
      "retrieval_date": "2026-09-21",
      "url": "https://arxiv.org/abs/2409.12055v2",
      "locator_status": "known",
      "evidence_status": "retained",
      "claim_status": "author_claim",
      "scope": "Generic commit-and-prove SNARK construction linking a proof witness to externally committed values through homomorphic polynomial commitments, with a Halo2 zkML implementation.",
      "limitations": ["The external commitment must support the construction's homomorphic polynomial-commitment interface; Pearl's keyed BLAKE3 matrix root is not such a commitment, so Artemis is not a drop-in Pearl bridge.", "The evaluation and speedups are author-reported and were not reproduced by Aeye.", "Witness-to-model commitment consistency does not by itself establish native work, activation origin, full execution, hardware provenance, or demand."],
      "artifact": {"type": "file", "path": "evidence/papers/artemis-2409.12055v2.pdf", "sha256": "sha256:ac5a6deeb034d06997c22f5c1946c711bc839f9ae258747ca8b53969bef8f490", "media_type": "application/pdf", "retrieval_url": "https://arxiv.org/pdf/2409.12055v2"}
    },
    {
      "source_id": "eprint:2026/1112",
      "kind": "paper",
      "title": "DeepProve: Verifiable End-to-End Large Language Model Inference",
      "authors": ["Nicolas Gailly", "Ismael Hishon-Rezaizadeh", "Tianyi Liu", "Nicholas Mainardi", "Dimitrios Papadopoulos", "Charalampos Papamanthou", "Christodoulos Pappas", "Shravan Srinivasan", "Zack Youell", "Yupeng Zhang"],
      "version": "IACR ePrint 2026/1112; CCS 2026 minor revision",
      "publication_date": "2026-05-30",
      "publication_date_status": "known",
      "publication_date_precision": "day",
      "retrieval_date": "2026-08-30",
      "url": "https://eprint.iacr.org/2026/1112",
      "locator_status": "known",
      "evidence_status": "retained",
      "claim_status": "author_claim",
      "scope": "End-to-end proof relation for quantized GPT-2 and Gemma 3 autoregressive inference.",
      "limitations": ["Performance is author-reported and not reproduced by Aeye.", "The relation is quantized arithmetic, not native GPU semantics, physical work, or demand."],
      "artifact": {"type": "file", "path": "evidence/papers/deepprove-2026-1112.pdf", "sha256": "sha256:d728bb2c1ac36fdbbe5de3f28cb17f75f1ac918b643aa653a5de2e870dfa44c8", "media_type": "application/pdf", "retrieval_url": "https://eprint.iacr.org/2026/1112.pdf"}
    },
    {
      "source_id": "eprint:2026/1492",
      "kind": "paper",
      "title": "Proof of Demand Is Not Proof of Work: On the Limits of Demand-Weighted Consensus under Free Pseudonyms",
      "authors": ["Ömer Demirel"],
      "version": "IACR ePrint 2026/1492; revision 2026-08-23",
      "publication_date": "2026-08-23",
      "publication_date_status": "known",
      "publication_date_precision": "day",
      "retrieval_date": "2026-09-21",
      "url": "https://eprint.iacr.org/2026/1492",
      "locator_status": "known",
      "evidence_status": "retained",
      "claim_status": "author_claim",
      "scope": "Separates work soundness, job binding, and demand exogeneity and gives conditional impossibility and cost results for certifying economically independent demand from endogenous receipts under free pseudonyms.",
      "limitations": ["The demand-indistinguishability theorem is conditional on its fungibility, coalition-control, realizability, or indistinguishability premises; exogenous trust roots or costly provenance may change the setting.", "It supplies no construction for Pearl-specific execution binding and does not make every demand signal impossible.", "The paper is a preprint and its deployed-system discussion was not independently reproduced by Aeye."],
      "artifact": {"type": "file", "path": "evidence/papers/proof-of-demand-2026-1492.pdf", "sha256": "sha256:4531a1cafc4621fbfd18945aba818a8c43fc491725fe7b6f38097e492e67139d", "media_type": "application/pdf", "retrieval_url": "https://eprint.iacr.org/2026/1492.pdf"}
    },
    {
      "source_id": "arxiv:2511.20621v1",
      "kind": "paper",
      "title": "DiFR: Inference Verification Despite Nondeterminism",
      "authors": ["Adam Karvonen", "Daniel Reuter", "Roy Rinberg", "Luke Marks", "Adrià Garriga-Alonso", "Keri Warr"],
      "version": "arXiv:2511.20621v1",
      "publication_date": "2025-11-25",
      "publication_date_status": "known",
      "publication_date_precision": "day",
      "retrieval_date": "2026-08-30",
      "url": "https://arxiv.org/abs/2511.20621",
      "locator_status": "known",
      "evidence_status": "retained",
      "claim_status": "author_claim",
      "scope": "Statistical token and activation divergence signals for inference auditing.",
      "limitations": ["Detection depends on the reference, null distribution, attack distribution, and sample size.", "It is not cryptographic execution soundness."],
      "artifact": {"type": "file", "path": "evidence/papers/difr-2511.20621.pdf", "sha256": "sha256:6bb442acbe408ded68c5f65a7b58d9d37d6d6bbb6915afc866caef2e6bee4dd2", "media_type": "application/pdf", "retrieval_url": "https://arxiv.org/pdf/2511.20621v1"}
    },
    {
      "source_id": "arxiv:2606.22560v1",
      "kind": "paper",
      "title": "Evidence-Bound Gateway-Path Provenance for Third-Party LLM Inference",
      "authors": ["Fei Wang", "Zebai Tian"],
      "version": "arXiv:2606.22560v1",
      "publication_date": "2026-06-21",
      "publication_date_status": "known",
      "publication_date_precision": "day",
      "retrieval_date": "2026-09-21",
      "url": "https://arxiv.org/abs/2606.22560",
      "locator_status": "known",
      "evidence_status": "retained",
      "claim_status": "author_claim",
      "scope": "TEE-backed request, policy, route, endpoint-observation, and encrypted-stream provenance for third-party LLM gateways.",
      "limitations": ["The construction assumes an uncompromised TEE, attestation root, release-signing path, verifier, and dependency supply chain.", "It explicitly does not prove that the upstream provider served the claimed model or executed inference correctly.", "It does not bind Pearl commitments or establish useful work or independent demand; prototype results are author-reported and were not reproduced by Aeye."],
      "artifact": {"type": "file", "path": "evidence/papers/gateway-path-provenance-2606.22560.pdf", "sha256": "sha256:657661e25829f1fcfde41fc2fd3ba8951697bd7809a09ff68a464e7cc16e96fb", "media_type": "application/pdf", "retrieval_url": "https://arxiv.org/pdf/2606.22560v1"}
    },
    {
      "source_id": "arxiv:2603.20421v2",
      "kind": "paper",
      "title": "Hawkeye: Reproducing GPU-Level Non-Determinism",
      "authors": ["Erez Badash", "Dan Boneh", "Ilan Komargodski", "Megha Srivastava"],
      "version": "arXiv:2603.20421v2; MLSys 2026",
      "publication_date": "2026-05-15",
      "publication_date_status": "known",
      "publication_date_precision": "day",
      "retrieval_date": "2026-08-30",
      "url": "https://arxiv.org/abs/2603.20421",
      "locator_status": "known",
      "evidence_status": "retained",
      "claim_status": "author_claim",
      "scope": "CPU reproduction of selected NVIDIA Tensor Core MMA arithmetic.",
      "limitations": ["Instruction-level empirical conformance is not execution provenance or device identity.", "It does not cover complete inference glue."],
      "artifact": {"type": "file", "path": "evidence/papers/hawkeye-2603.20421.pdf", "sha256": "sha256:4e9ea2ca68f9be74e8f93e0eb530db501f9e226ba5b185750685f20ed4f9b4a5", "media_type": "application/pdf", "retrieval_url": "https://arxiv.org/pdf/2603.20421v2"}
    },
    {
      "source_id": "arxiv:2607.28884v1",
      "kind": "paper",
      "title": "Hollow-LLM Attack: Computationally Trivial Weights in Zero-Knowledge Verification of LLM Inference",
      "authors": ["Chen Gong", "Beijie Liu", "Mengyuan Li"],
      "version": "arXiv:2607.28884v1; IEEE S&P 2026",
      "publication_date": "2026-07-30",
      "publication_date_status": "known",
      "publication_date_precision": "day",
      "retrieval_date": "2026-08-30",
      "url": "https://arxiv.org/abs/2607.28884",
      "locator_status": "known",
      "evidence_status": "retained",
      "claim_status": "author_claim",
      "scope": "Separation attack between a valid inference relation and substantial computational effort.",
      "limitations": ["The concrete ghost-weight constructions do not establish that every proof system admits the same shortcut.", "It directly motivates keeping WORK separate from EXECUTION."],
      "artifact": {"type": "file", "path": "evidence/papers/hollow-llm-2607.28884.pdf", "sha256": "sha256:0327c02c841e822a420300a7c404e06957509e86fb121c1cb28814bd12c8d84d", "media_type": "application/pdf", "retrieval_url": "https://arxiv.org/pdf/2607.28884v1"}
    },
    {
      "source_id": "arxiv:2602.22700v1",
      "kind": "paper",
      "title": "IMMACULATE: A Practical LLM Auditing Framework via Verifiable Computation",
      "authors": ["Yanpei Guo", "Wenjie Qu", "Linyu Wu", "Shengfang Zhai", "Lionel Z. Wang", "Ming Xu", "Yue Liu", "Binhang Yuan", "Dawn Song", "Jiaheng Zhang"],
      "version": "arXiv:2602.22700v1",
      "publication_date": "2026-02-26",
      "publication_date_status": "known",
      "publication_date_precision": "day",
      "retrieval_date": "2026-08-30",
      "url": "https://arxiv.org/abs/2602.22700",